{
  "$schema": "https://json-schema.org/draft/2020-12/schema",
  "$id": "https://agent-workflow.local/schemas/workflow-policy.json",
  "version": 9,
  "scope_rank": {
    "file": 1,
    "module": 2,
    "multi_module": 3,
    "cross_project": 4
  },
  "capabilities": [
    {
      "name": "impact_discovery",
      "kind": "evidence",
      "section": "Impact discovery",
      "order_after": [],
      "require_when": [
        [
          {
            "impact_confidence": [
              "medium",
              "low"
            ]
          }
        ]
      ],
      "steps": [
        {
          "id": "ID1",
          "title": "列出變更入口、分析覆蓋度與限制",
          "when": [
            [
              {
                "always": true
              }
            ]
          ]
        },
        {
          "id": "ID2",
          "title": "人工盤點 consumer、共享狀態與外部契約",
          "when": [
            [
              {
                "always": true
              }
            ]
          ]
        },
        {
          "id": "ID3",
          "title": "確認可升級的 impact scope／effect 與殘餘 unknown",
          "when": [
            [
              {
                "always": true
              }
            ]
          ]
        }
      ]
    },
    {
      "name": "schema_compatibility",
      "kind": "evidence",
      "section": "Schema compatibility",
      "order_after": [],
      "require_when": [
        [
          {
            "risk_flags": [
              "schema",
              "migration"
            ]
          }
        ]
      ],
      "steps": [
        {
          "id": "SC1",
          "title": "列出每個 DDL statement 與操作類別",
          "when": [
            [
              {
                "always": true
              }
            ]
          ]
        },
        {
          "id": "SC2",
          "title": "逐條分類 additive / mutating / destructive",
          "when": [
            [
              {
                "always": true
              }
            ]
          ]
        },
        {
          "id": "SC3",
          "title": "滾動部署相容性：新舊版程式併存時的讀寫",
          "when": [
            [
              {
                "not": {
                  "fact": "has_consumer",
                  "equals": [
                    false
                  ]
                }
              }
            ],
            [
              {
                "impact_scope_at_least": "module"
              }
            ]
          ]
        },
        {
          "id": "SC4",
          "title": "索引／約束的鎖與唯一性衝突",
          "when": [
            [
              {
                "fact": "schema_constraint_change",
                "equals": [
                  true
                ]
              }
            ]
          ]
        },
        {
          "id": "SC5",
          "title": "回滾可行性與逆轉後的舊資料狀態",
          "when": [
            [
              {
                "risk_flags": [
                  "irreversible"
                ]
              }
            ],
            [
              {
                "not": {
                  "fact": "schema_operation",
                  "equals": [
                    "none",
                    "additive_nullable"
                  ]
                }
              }
            ]
          ]
        }
      ]
    },
    {
      "name": "migration_safety",
      "kind": "evidence",
      "section": "Migration safety",
      "order_after": [
        "schema_compatibility"
      ],
      "require_when": [
        [
          {
            "risk_flags": [
              "migration"
            ]
          }
        ]
      ],
      "steps": [
        {
          "id": "MS1",
          "title": "受影響資料量級與預期執行時間",
          "when": [
            [
              {
                "always": true
              }
            ]
          ]
        },
        {
          "id": "MS2",
          "title": "鎖行為與線上影響（是否阻塞讀寫）",
          "when": [
            [
              {
                "impact_scope_at_least": "module"
              }
            ],
            [
              {
                "risk_flags": [
                  "migration"
                ]
              }
            ]
          ]
        },
        {
          "id": "MS3",
          "title": "冪等性與可重入（中斷後重跑）",
          "when": [
            [
              {
                "always": true
              }
            ]
          ]
        },
        {
          "id": "MS4",
          "title": "分段／批次策略",
          "when": [
            [
              {
                "fact": "data_transform",
                "equals": [
                  true
                ]
              }
            ]
          ]
        },
        {
          "id": "MS5",
          "title": "回滾腳本與回滾後資料狀態",
          "when": [
            [
              {
                "risk_flags": [
                  "irreversible"
                ]
              }
            ],
            [
              {
                "fact": "destructive_operation",
                "equals": [
                  true
                ]
              }
            ]
          ]
        },
        {
          "id": "MS6",
          "title": "一次性 Docker／SQL 環境實測",
          "when": [
            [
              {
                "risk_flags": [
                  "migration"
                ]
              }
            ]
          ]
        }
      ]
    },
    {
      "name": "data_impact",
      "kind": "evidence",
      "section": "Contract and data impact",
      "order_after": [
        "schema_compatibility"
      ],
      "require_when": [
        [
          {
            "impact_effect": [
              "data",
              "destructive"
            ]
          }
        ],
        [
          {
            "risk_flags": [
              "data_write",
              "financial",
              "migration",
              "irreversible"
            ]
          }
        ]
      ],
      "steps": [
        {
          "id": "DI1",
          "title": "受影響資料範圍（表、列、量級）",
          "when": [
            [
              {
                "always": true
              }
            ]
          ]
        },
        {
          "id": "DI2",
          "title": "寫入路徑盤點：producer 與所有 writers，schema 變更後逐一驗證輸出",
          "when": [
            [
              {
                "impact_effect": [
                  "data",
                  "destructive"
                ]
              }
            ],
            [
              {
                "risk_flags": [
                  "data_write"
                ]
              }
            ]
          ]
        },
        {
          "id": "DI3",
          "title": "完整資料鏈：producer → storage → reader → index/schema，含 scope filter、metadata round trip 與 NULL／預設值語意",
          "when": [
            [
              {
                "not": {
                  "fact": "has_consumer",
                  "equals": [
                    false
                  ]
                }
              }
            ]
          ]
        },
        {
          "id": "DI4",
          "title": "backfill／transform 正確性與既有髒資料",
          "when": [
            [
              {
                "fact": "data_transform",
                "equals": [
                  true
                ]
              }
            ]
          ]
        },
        {
          "id": "DI5",
          "title": "不變式與對帳（總額、筆數、狀態機守恆）",
          "when": [
            [
              {
                "risk_flags": [
                  "financial",
                  "irreversible"
                ]
              }
            ]
          ]
        },
        {
          "id": "DI6",
          "title": "資料回復方案（備份點、可否重算）",
          "when": [
            [
              {
                "fact": "destructive_operation",
                "equals": [
                  true
                ]
              }
            ],
            [
              {
                "risk_flags": [
                  "irreversible"
                ]
              }
            ]
          ]
        }
      ]
    },
    {
      "name": "contract_review",
      "kind": "evidence",
      "section": "Contract and data impact",
      "order_after": [],
      "require_when": [
        [
          {
            "risk_flags": [
              "contract"
            ]
          }
        ]
      ],
      "steps": [
        {
          "id": "CR1",
          "title": "介面清單 diff：API／DTO／event／序列化欄位",
          "when": [
            [
              {
                "always": true
              }
            ]
          ]
        },
        {
          "id": "CR2",
          "title": "逐項分類 additive / breaking",
          "when": [
            [
              {
                "always": true
              }
            ]
          ]
        },
        {
          "id": "CR3",
          "title": "consumer 盤點（內部呼叫端、外部串接方）",
          "when": [
            [
              {
                "impact_scope_at_least": "multi_module"
              }
            ],
            [
              {
                "impact_effect": [
                  "contract"
                ]
              }
            ]
          ]
        },
        {
          "id": "CR4",
          "title": "版本化與過渡策略（雙寫、雙讀、deprecation）",
          "when": [
            [
              {
                "impact_effect": [
                  "contract"
                ]
              }
            ],
            [
              {
                "risk_flags": [
                  "contract"
                ]
              }
            ]
          ]
        },
        {
          "id": "CR5",
          "title": "跨專案協調需求與通知對象",
          "when": [
            [
              {
                "impact_scope": [
                  "cross_project"
                ]
              }
            ]
          ]
        }
      ]
    },
    {
      "name": "execution_path_review",
      "kind": "evidence",
      "section": "Execution path and regression evidence",
      "order_after": [